Title,Media URL,Pinterest board,Thumbnail,Description,Link,Publish date,Keywords
Discord Fonts Copy & Paste (No Nitro Needed) — Free Generator,https://ultratextgen.com/assets/pinterest/discord/fonts-copy-paste.png,"Discord Fonts, Symbols & Names",,"Discord Fonts Copy & Paste — Type once, copy any style, paste into Discord — no Nitro needed. Type once and copy every Unicode style at UltraTextGen: free, in your browser, no app and no Nitro. Great for usernames, display names, bios, messages and server text.",https://ultratextgen.com/discord/?utm_source=pinterest&utm_medium=social&utm_campaign=discord_pins&utm_content=fonts-copy-paste,,"discord fonts, discord fonts copy and paste, fonts for discord, discord font copy and paste, discord font"
Turn Your Discord Name Into a Font — Copy & Paste Username Styles,https://ultratextgen.com/assets/pinterest/discord/name-as-a-font.png,"Discord Fonts, Symbols & Names",,"Turn Your Discord Name Into a Font — Style your username in seconds — works in your display name & profile. Type once and copy every Unicode style at UltraTextGen: free, in your browser, no app and no Nitro. Great for usernames, display names, bios, messages and server text.",https://ultratextgen.com/discord/?utm_source=pinterest&utm_medium=social&utm_campaign=discord_pins&utm_content=name-as-a-font,,"discord name as a font, discord name font, discord name fonts, different discord fonts for name, discord username fonts"
How to Change Your Discord Name Font — 3 Easy Steps (Free),https://ultratextgen.com/assets/pinterest/discord/change-name-font.png,"Discord Fonts, Symbols & Names",,"How to Change Your Discord Name Font — Three steps: type your name, pick a font, paste it into Discord. Type once and copy every Unicode style at UltraTextGen: free, in your browser, no app and no Nitro. Great for usernames, display names, bios, messages and server text.",https://ultratextgen.com/discord/?utm_source=pinterest&utm_medium=social&utm_campaign=discord_pins&utm_content=change-name-font,,"how to change discord name font, how to change font on discord, how to change font in discord, discord font change, discord font changer"
Free Discord Font Generator — Copy & Paste Fonts for Discord,https://ultratextgen.com/assets/pinterest/discord/font-generator.png,"Discord Fonts, Symbols & Names",,"Free Discord Font Generator — Dozens of copy-paste fonts for names, messages and bios. Type once and copy every Unicode style at UltraTextGen: free, in your browser, no app and no Nitro. Great for usernames, display names, bios, messages and server text.",https://ultratextgen.com/discord/?utm_source=pinterest&utm_medium=social&utm_campaign=discord_pins&utm_content=font-generator,,"discord font generator, font generator discord, discord fonts generator, font generator for discord, font for discord"
"Bold, Italic & Small Text for Discord — Copy & Paste",https://ultratextgen.com/assets/pinterest/discord/bold-small-text.png,"Discord Fonts, Symbols & Names",,"Bold, Italic & Small Text for Discord — Real Unicode bold, italics and tiny small-caps that paste anywhere. Type once and copy every Unicode style at UltraTextGen: free, in your browser, no app and no Nitro. Great for usernames, display names, bios, messages and server text.",https://ultratextgen.com/discord/?utm_source=pinterest&utm_medium=social&utm_campaign=discord_pins&utm_content=bold-small-text,,"discord bold font, small font discord, discord bold text, discord italic, discord text font"
"Discord Text Formatting & Font Commands — Bold, Italic & Beyond",https://ultratextgen.com/assets/pinterest/discord/text-formatting.png,"Discord Fonts, Symbols & Names",,"Discord Text Formatting & Font Commands — Markdown does bold & italics; Unicode fonts do everything else. Type once and copy every Unicode style at UltraTextGen: free, in your browser, no app and no Nitro. Great for usernames, display names, bios, messages and server text.",https://ultratextgen.com/discord/?utm_source=pinterest&utm_medium=social&utm_campaign=discord_pins&utm_content=text-formatting,,"discord font commands, discord text formatting, discord fonts commands, discord font size command, how do discord font"
What Font Does Discord Use? (And How to Add Your Own),https://ultratextgen.com/assets/pinterest/discord/what-font-discord.png,"Discord Fonts, Symbols & Names",,"What Font Does Discord Use? — Discord's default is gg sans — here's how to add fancy fonts yourself. Type once and copy every Unicode style at UltraTextGen: free, in your browser, no app and no Nitro. Great for usernames, display names, bios, messages and server text.",https://ultratextgen.com/answers/what-font-does-discord-use/?utm_source=pinterest&utm_medium=social&utm_campaign=discord_pins&utm_content=what-font-discord,,"what font does discord use, what font does discord use for text, discord font name, discord text fonts, font discord"
Discord Display Name Styles — Aesthetic Fonts to Copy & Paste,https://ultratextgen.com/assets/pinterest/discord/display-name-styles.png,"Discord Fonts, Symbols & Names",,"Discord Display Name Styles — Style your display name without touching your real username. Type once and copy every Unicode style at UltraTextGen: free, in your browser, no app and no Nitro. Great for usernames, display names, bios, messages and server text.",https://ultratextgen.com/discord/?utm_source=pinterest&utm_medium=social&utm_campaign=discord_pins&utm_content=display-name-styles,,"discord display name font, discord display name, display name discord, discord name style, discord display name styles"
Aesthetic Discord Names to Copy & Paste — Username Ideas,https://ultratextgen.com/assets/pinterest/discord/names-copy-paste.png,"Discord Fonts, Symbols & Names",,"Aesthetic Discord Names to Copy & Paste — Ready-made styled names — just copy your favourite and paste. Type once and copy every Unicode style at UltraTextGen: free, in your browser, no app and no Nitro. Great for usernames, display names, bios, messages and server text.",https://ultratextgen.com/discord/?utm_source=pinterest&utm_medium=social&utm_campaign=discord_pins&utm_content=names-copy-paste,,"discord names copy and paste, aesthetic discord names, cool discord fonts, discord username ideas, discord fonts copy and paste"
Discord Symbols for Usernames — Copy & Paste Name Decorations,https://ultratextgen.com/assets/pinterest/discord/symbols-for-names.png,"Discord Fonts, Symbols & Names",,"Discord Symbols for Usernames — Decorate your name with brackets, stars and dividers that paste cleanly. Type once and copy every Unicode style at UltraTextGen: free, in your browser, no app and no Nitro. Great for usernames, display names, bios, messages and server text.",https://ultratextgen.com/library/discord-symbols/?utm_source=pinterest&utm_medium=social&utm_campaign=discord_pins&utm_content=symbols-for-names,,"discord symbols, discord font symbols, symbols for discord name, discord symbols copy and paste, discord fonts symbols"
Which Characters Work in Discord Names — Allowed Symbols Guide,https://ultratextgen.com/assets/pinterest/discord/allowed-characters.png,"Discord Fonts, Symbols & Names",,"Which Characters Work in Discord Names — Not every symbol survives Discord's filter — here's what actually pastes. Type once and copy every Unicode style at UltraTextGen: free, in your browser, no app and no Nitro. Great for usernames, display names, bios, messages and server text.",https://ultratextgen.com/answers/discord-allowed-characters/?utm_source=pinterest&utm_medium=social&utm_campaign=discord_pins&utm_content=allowed-characters,,"discord allowed characters, symbols that work in discord, discord name characters, characters for discord name, discord symbols"
Fonts for Discord Servers & Channels — Copy & Paste Styles,https://ultratextgen.com/assets/pinterest/discord/server-channel-fonts.png,"Discord Fonts, Symbols & Names",,"Fonts for Discord Servers & Channels — Style channel names, categories and intro text so your server stands out. Type once and copy every Unicode style at UltraTextGen: free, in your browser, no app and no Nitro. Great for usernames, display names, bios, messages and server text.",https://ultratextgen.com/discord/?utm_source=pinterest&utm_medium=social&utm_campaign=discord_pins&utm_content=server-channel-fonts,,"introduction fonts discord, discord channel symbols, discord server fonts, channel name fonts discord, fonts discord"
