Title,Media URL,Pinterest board,Thumbnail,Description,Link,Publish date,Keywords
Tulisan TikTok Aesthetic — Font Nama & Bio Copy Paste,https://ultratextgen.com/assets/pinterest/id/tulisan-tiktok-aesthetic.png,"Tulisan Aesthetic, Font & Simbol Keren (Copy Paste)",,"Tulisan TikTok Aesthetic — Font buat nama, bio & caption TikTok biar makin standout. Ketik sekali, salin semua gaya Unicode di UltraTextGen: gratis, langsung di browser, tanpa aplikasi. Cocok untuk bio, caption, nama, status & komentar.",https://ultratextgen.com/id/?utm_source=pinterest&utm_medium=social&utm_campaign=id_howto_pins&utm_content=tulisan-tiktok-aesthetic,,"tulisan tiktok aesthetic, font tiktok aesthetic, nama tiktok aesthetic, font tiktok, tulisan aesthetic"
Font ML Aesthetic — Nickname Mobile Legends Copy Paste,https://ultratextgen.com/assets/pinterest/id/font-ml-aesthetic.png,"Tulisan Aesthetic, Font & Simbol Keren (Copy Paste)",,"Font ML Aesthetic — Nickname Mobile Legends keren yang bisa dipakai di game. Ketik sekali, salin semua gaya Unicode di UltraTextGen: gratis, langsung di browser, tanpa aplikasi. Cocok untuk bio, caption, nama, status & komentar.",https://ultratextgen.com/id/?utm_source=pinterest&utm_medium=social&utm_campaign=id_howto_pins&utm_content=font-ml-aesthetic,,"font ml aesthetic, font yang bisa di ml, nickname ml keren, nickname ml simple, font keren untuk nickname"
Ubah Tulisan Jadi Aesthetic — Generator Gratis Copy Paste,https://ultratextgen.com/assets/pinterest/id/ketikan-aesthetic.png,"Tulisan Aesthetic, Font & Simbol Keren (Copy Paste)",,"Ubah Tulisan Jadi Aesthetic — Ketik teks biasa, langsung diubah jadi puluhan gaya estetik. Ketik sekali, salin semua gaya Unicode di UltraTextGen: gratis, langsung di browser, tanpa aplikasi. Cocok untuk bio, caption, nama, status & komentar.",https://ultratextgen.com/id/?utm_source=pinterest&utm_medium=social&utm_campaign=id_howto_pins&utm_content=ketikan-aesthetic,,"ketikan aesthetic, ubah tulisan jadi aesthetic, bikin tulisan aesthetic, buat tulisan aesthetic, edit tulisan aesthetic"
Gaya Tulisan Aesthetic — Banyak Pilihan Font Copy Paste,https://ultratextgen.com/assets/pinterest/id/gaya-tulisan-aesthetic.png,"Tulisan Aesthetic, Font & Simbol Keren (Copy Paste)",,"Gaya Tulisan Aesthetic — Banyak pilihan gaya font aesthetic dalam satu tempat. Ketik sekali, salin semua gaya Unicode di UltraTextGen: gratis, langsung di browser, tanpa aplikasi. Cocok untuk bio, caption, nama, status & komentar.",https://ultratextgen.com/id/?utm_source=pinterest&utm_medium=social&utm_campaign=id_howto_pins&utm_content=gaya-tulisan-aesthetic,,"gaya tulisan aesthetic, gaya font aesthetic, gaya tulisan, model tulisan aesthetic, tulisan aesthetic"
Tulisan Aesthetic Dark & Gothic — Font Copy Paste,https://ultratextgen.com/assets/pinterest/id/tulisan-aesthetic-dark.png,"Tulisan Aesthetic, Font & Simbol Keren (Copy Paste)",,"Tulisan Aesthetic Dark — Vibe gelap & gothic buat nama, bio, dan caption misterius. Ketik sekali, salin semua gaya Unicode di UltraTextGen: gratis, langsung di browser, tanpa aplikasi. Cocok untuk bio, caption, nama, status & komentar.",https://ultratextgen.com/id/?utm_source=pinterest&utm_medium=social&utm_campaign=id_howto_pins&utm_content=tulisan-aesthetic-dark,,"tulisan dark aesthetic, tulisan aesthetic dark, font gothic, font dark aesthetic, tulisan keren dark"
Caption Aesthetic buat Story IG — Font Copy Paste,https://ultratextgen.com/assets/pinterest/id/caption-aesthetic-story.png,"Tulisan Aesthetic, Font & Simbol Keren (Copy Paste)",,"Caption Aesthetic buat Story — Caption estetik biar story & feed kamu makin nempel di mata. Ketik sekali, salin semua gaya Unicode di UltraTextGen: gratis, langsung di browser, tanpa aplikasi. Cocok untuk bio, caption, nama, status & komentar.",https://ultratextgen.com/id/?utm_source=pinterest&utm_medium=social&utm_campaign=id_howto_pins&utm_content=caption-aesthetic-story,,"caption aesthetic, tulisan story aesthetic, caption estetik, teks estetik, tulisan aesthetic"
Tulisan Rapi & Aesthetic — Font Bersih Copy Paste,https://ultratextgen.com/assets/pinterest/id/tulisan-rapi-aesthetic.png,"Tulisan Aesthetic, Font & Simbol Keren (Copy Paste)",,"Tulisan Rapi & Aesthetic — Font bersih dan rapi yang tetap kelihatan estetik. Ketik sekali, salin semua gaya Unicode di UltraTextGen: gratis, langsung di browser, tanpa aplikasi. Cocok untuk bio, caption, nama, status & komentar.",https://ultratextgen.com/id/?utm_source=pinterest&utm_medium=social&utm_campaign=id_howto_pins&utm_content=tulisan-rapi-aesthetic,,"tulisan rapi dan aesthetic, tulisan rapi aesthetic, tulisan bagus aesthetic, font rapi aesthetic, tulisan aesthetic"
Huruf Aesthetic buat Nickname — Font Keren Copy Paste,https://ultratextgen.com/assets/pinterest/id/huruf-aesthetic-nickname.png,"Tulisan Aesthetic, Font & Simbol Keren (Copy Paste)",,"Huruf Aesthetic buat Nickname — Huruf estetik biar nickname & username kamu beda sendiri. Ketik sekali, salin semua gaya Unicode di UltraTextGen: gratis, langsung di browser, tanpa aplikasi. Cocok untuk bio, caption, nama, status & komentar.",https://ultratextgen.com/id/?utm_source=pinterest&utm_medium=social&utm_campaign=id_howto_pins&utm_content=huruf-aesthetic-nickname,,"huruf aesthetic untuk nickname, font keren untuk nickname, huruf aesthetic nickname, nickname aesthetic, huruf aesthetic"
Abjad Aesthetic A–Z — Huruf Abjad Copy Paste,https://ultratextgen.com/assets/pinterest/id/abjad-aesthetic.png,"Tulisan Aesthetic, Font & Simbol Keren (Copy Paste)",,"Abjad Aesthetic A–Z — Semua abjad A sampai Z dalam berbagai gaya, tinggal salin. Ketik sekali, salin semua gaya Unicode di UltraTextGen: gratis, langsung di browser, tanpa aplikasi. Cocok untuk bio, caption, nama, status & komentar.",https://ultratextgen.com/id/?utm_source=pinterest&utm_medium=social&utm_campaign=id_howto_pins&utm_content=abjad-aesthetic,,"abjad aesthetic, huruf abjad aesthetic, tulisan abjad aesthetic, abjad aesthetic copy paste, huruf aesthetic"
Tulisan Aesthetic Simple & Minimalis — Copy Paste,https://ultratextgen.com/assets/pinterest/id/tulisan-aesthetic-simple.png,"Tulisan Aesthetic, Font & Simbol Keren (Copy Paste)",,"Tulisan Aesthetic Simple — Gaya minimalis & simple yang tetap estetik buat profil. Ketik sekali, salin semua gaya Unicode di UltraTextGen: gratis, langsung di browser, tanpa aplikasi. Cocok untuk bio, caption, nama, status & komentar.",https://ultratextgen.com/id/?utm_source=pinterest&utm_medium=social&utm_campaign=id_howto_pins&utm_content=tulisan-aesthetic-simple,,"tulisan aesthetic simple, font simple aesthetic, tulisan simple aesthetic, font minimalis aesthetic, tulisan aesthetic"
Huruf Kecil Aesthetic (Small Caps) — Copy Paste,https://ultratextgen.com/assets/pinterest/id/huruf-kecil-aesthetic.png,"Tulisan Aesthetic, Font & Simbol Keren (Copy Paste)",,"Huruf Kecil Aesthetic — Font huruf kecil (small caps) yang aesthetic buat bio & nama. Ketik sekali, salin semua gaya Unicode di UltraTextGen: gratis, langsung di browser, tanpa aplikasi. Cocok untuk bio, caption, nama, status & komentar.",https://ultratextgen.com/id/?utm_source=pinterest&utm_medium=social&utm_campaign=id_howto_pins&utm_content=huruf-kecil-aesthetic,,"huruf kecil aesthetic, font kecil aesthetic, small caps aesthetic, tulisan kecil aesthetic, huruf aesthetic"
Simbol & Huruf Aesthetic Copy Paste — Hiasan Teks,https://ultratextgen.com/assets/pinterest/id/simbol-huruf-aesthetic.png,"Tulisan Aesthetic, Font & Simbol Keren (Copy Paste)",,"Simbol & Huruf Aesthetic — Gabungkan huruf estetik dengan simbol hiasan sekali klik. Ketik sekali, salin semua gaya Unicode di UltraTextGen: gratis, langsung di browser, tanpa aplikasi. Cocok untuk bio, caption, nama, status & komentar.",https://ultratextgen.com/id/?utm_source=pinterest&utm_medium=social&utm_campaign=id_howto_pins&utm_content=simbol-huruf-aesthetic,,"simbol huruf aesthetic, simbol aesthetic, hiasan tulisan aesthetic, simbol keren aesthetic, huruf aesthetic"
Tulisan Nama WA Keren Aesthetic — Font Copy Paste,https://ultratextgen.com/assets/pinterest/id/tulisan-nama-wa-aesthetic.png,"Tulisan Aesthetic, Font & Simbol Keren (Copy Paste)",,"Tulisan Nama WA Aesthetic — Bikin nama & status WhatsApp kamu keren dan aesthetic. Ketik sekali, salin semua gaya Unicode di UltraTextGen: gratis, langsung di browser, tanpa aplikasi. Cocok untuk bio, caption, nama, status & komentar.",https://ultratextgen.com/id/?utm_source=pinterest&utm_medium=social&utm_campaign=id_howto_pins&utm_content=tulisan-nama-wa-aesthetic,,"tulisan nama wa keren aesthetic, nama wa aesthetic, font wa aesthetic, tulisan nama wa, tulisan aesthetic"
Font Aesthetic Tinggal Copy — Salin Sekali Tap,https://ultratextgen.com/assets/pinterest/id/font-aesthetic-copy.png,"Tulisan Aesthetic, Font & Simbol Keren (Copy Paste)",,"Font Aesthetic Tinggal Copy — Pilih gaya, tap untuk salin, langsung tempel di mana saja. Ketik sekali, salin semua gaya Unicode di UltraTextGen: gratis, langsung di browser, tanpa aplikasi. Cocok untuk bio, caption, nama, status & komentar.",https://ultratextgen.com/id/?utm_source=pinterest&utm_medium=social&utm_campaign=id_howto_pins&utm_content=font-aesthetic-copy,,"font aesthetic copy, salin font aesthetic, huruf aesthetic copy, font aesthetic copy paste, tulisan aesthetic copy"
