id,primary_keyword,modifier,intent,forum_queries,forum_evidence,forum_source_urls,search_volume,demand_confidence,symbol_category,unicode_blocks,copy_patterns,slug,title,priority_score,dedupe_status,approval_status,batch,notes
OPP-0001,copyright symbol,trademark legal copy paste,find-and-copy,"site:reddit.com copyright trademark symbol copy paste | site:quora.com how to type trademark symbol | site:stackexchange.com registered trademark unicode",medium,"https://www.google.com/search?q=site:reddit.com+copyright+trademark+symbol+copy+paste | https://www.google.com/search?q=site:quora.com+how+to+type+trademark+symbol",60500,high,legal,"Latin-1 Supplement (U+00A9..U+00AE) | Letterlike Symbols (U+2100..U+214F) | Enclosed Alphanumerics (U+24B6..U+24E9)",single,copyright-trademark-symbols,"Copyright, Trademark & Legal Symbols: Copy & Paste © ® ™",89,clear,approved,batch-01-pilot,"CREATE. Cluster: tm symbol 74k + copyright 60.5k + trademark 60.5k + registered. No page purposed around legal/IP marks. Block overlap is incidental (© ® appear in many pages as decoration). score=vol22+forum15+copy22+dedupe18+depth12."
OPP-0002,degree symbol,temperature angle copy paste,find-and-copy,"site:reddit.com degree symbol copy paste | site:quora.com how to type degree symbol on keyboard | site:superuser.com degree sign shortcut",medium,"https://www.google.com/search?q=site:reddit.com+degree+symbol+copy+paste | https://www.google.com/search?q=site:quora.com+how+to+type+degree+symbol",110000,high,degree,"Latin-1 Supplement (U+00B0) | Letterlike Symbols (U+2103..U+212B) | General Punctuation (U+2032..U+2034)",single,degree-symbol,"Degree Symbol: Copy & Paste ° Temperature & Angle Signs",89,clear,approved,batch-01-pilot,"CREATE. degree 110k + degrees 49.5k + degree symbol copy paste 3.6k. No degree/temperature page exists. ° appears incidentally elsewhere; this page owns the intent. score=vol25+forum15+copy22+dedupe18+depth9."
OPP-0003,infinity symbol,copy paste variants,find-and-copy,"site:reddit.com infinity symbol copy paste | site:quora.com how to type infinity symbol | site:stackexchange.com infinity sign unicode",medium,"https://www.google.com/search?q=site:reddit.com+infinity+symbol+copy+paste | https://www.google.com/search?q=site:quora.com+how+to+type+infinity+symbol",49500,high,math,"Mathematical Operators (U+221D..U+221E) | Miscellaneous Mathematical Symbols-B (U+29DC..U+29DE) | Miscellaneous Symbols (U+267E)",single,infinity-symbol,"Infinity Symbol: Copy & Paste ∞ Infinity Signs & Variants",75,clear,approved,batch-01-pilot,"CREATE. infinity 49.5k + infinity copy paste 5.4k. ∞ appears in math-symbols incidentally; a focused infinity page targets a distinct head-noun intent (variants, meaning, tattoo). Conscious resolve of block overlap. score=vol18+forum15+copy20+dedupe15+depth7."
OPP-0004,square root symbol,radical copy paste,find-and-copy,"site:reddit.com square root symbol copy paste | site:quora.com how to type square root symbol | site:superuser.com radical sign shortcut",medium,"https://www.google.com/search?q=site:reddit.com+square+root+symbol+copy+paste | https://www.google.com/search?q=site:quora.com+how+to+type+square+root+symbol",60500,high,math,"Mathematical Operators (U+221A..U+221C) | Superscripts and Subscripts (U+2070..U+207F)",single,square-root-symbol,"Square Root Symbol: Copy & Paste √ Radical Signs",78,clear,approved,batch-01-pilot,"CREATE. square root symbol 60.5k. √ appears in math-symbols incidentally; a focused radical page targets the distinct 'square root symbol' intent. Conscious resolve of block overlap. score=vol22+forum15+copy20+dedupe15+depth6."
OPP-0005,fraction symbols,vulgar copy paste,find-and-copy,"site:reddit.com fraction symbols copy paste | site:quora.com how to type fractions unicode | site:stackexchange.com vulgar fraction characters",weak,"https://www.google.com/search?q=site:reddit.com+fraction+symbols+copy+paste | https://www.google.com/search?q=site:quora.com+how+to+type+fractions",6000,medium,numbers,"Latin-1 Supplement (U+00BC..U+00BE) | Number Forms (U+2150..U+215F)",single,fraction-symbols,"Fraction Symbols: Copy & Paste ½ ⅓ ¼ Unicode Fractions",73,clear,approved,batch-01-pilot,"CREATE. number-symbols has Roman/circled/superscript sections but NO vulgar-fraction section, so fractions are genuinely uncovered. search_volume is an estimate (no exact row in supplied keyword files). score=vol10+forum10+copy20+dedupe18+depth15."
